url,name,address,city,state,phone
https://www.lecentredentaire3r.com/,Results,"оғҲ1020 Bd des RГ©collets, Trois-RiviГЁres, QC G8Z 3X1, Canada",QC G8Z 3X1,Canada,оӮ°+1 819-376-1323
https://cdtr.ca/,Results,"оғҲ313 Rue Barkoff, Trois-RiviГЁres, QC G8T 2A5, Canada",QC G8T 2A5,Canada,оӮ°+1 819-693-3388
http://www.mondentistetr.com/,Results,"оғҲ4050 Bd des Forges, Trois-RiviГЁres, QC G8Y 1V7, Canada",QC G8Y 1V7,Canada,оӮ°+1 819-373-8636
http://www.centredentairerousseau.com/,Results,"оғҲ10 Rue Vaillancourt, Trois-RiviГЁres, QC G8T 1Y5, Canada",QC G8T 1Y5,Canada,оӮ°+1 819-373-3000
https://www.sourisalavie.com/,Results,"оғҲ5605 Boulevard Jean-XXIII, Trois-RiviГЁres, Quebec G8Z 4A8, Canada",Quebec G8Z 4A8,Canada,оӮ°+1 819-374-1822
https://www.cliniquedentairepointedulac.ca/site/accueil?utm_source=G&utm_medium=LPM&utm_campaign=DentalCorp,Results,"оғҲ9422 Chem. Sainte-Marguerite, Trois-RiviГЁres, QC G9B 6K2, Canada",QC G9B 6K2,Canada,оӮ°+1 819-581-2692
http://www.cliniquedentaireasselin.com/,Results,"оғҲ3196 Bd Saint-Jean, Trois-RiviГЁres, QC G9B 2M1, Canada",QC G9B 2M1,Canada,оӮ°+1 819-379-7901
https://centredentairesylviebeauclair.com/,Results,"оғҲ2800 Bd Thibeau, Trois-RiviГЁres, QC G8T 1G2, Canada",QC G8T 1G2,Canada,оӮ°+1 819-378-8888
http://cliniquedentairedeschenaux.com/,Results,"оғҲ1220 Rue Jean Nicolet, Trois-RiviГЁres, QC G9A 6M6, Canada",QC G9A 6M6,Canada,оӮ°+1 819-693-3368
https://laclinique.ca/,Results,"оғҲ3075 CГҙte Richelieu, Trois-RiviГЁres, QC G8Z 4C5, Canada",QC G8Z 4C5,Canada,оӮ°+1 819-371-3399
https://www.dentistescloutiercossette.com/,Results,"оғҲ250 Rue Vachon, Trois-RiviГЁres, QC G8T 8Y2, Canada",QC G8T 8Y2,Canada,оӮ°+1 819-374-7000
http://www.cliniquedent-r.com/,Results,"оғҲ2915 Rue Gagnon, Trois-RiviГЁres, QC G8Z 3Z4, Canada",QC G8Z 3Z4,Canada,оӮ°+1 819-371-2221
http://www.infodentiste.ca/,Results,"оғҲ4870 Bd des Forges, Trois-RiviГЁres, QC G8Y 1W9, Canada",QC G8Y 1W9,Canada,оӮ°+1 819-373-1313
http://www.laclinique.ca/,Results,"оғҲ3075 CГҙte Richelieu #100, Trois-RiviГЁres, Quebec G8Y 6L9, Canada",Quebec G8Y 6L9,Canada,оӮ°+1 819-371-3399
http://www.dentiste-troisrivieres.ca/,Results,"оғҲ1 Rue des Ormeaux, Trois-RiviГЁres, QC G8T 9P5, Canada",QC G8T 9P5,Canada,оӮ°+1 819-909-9333
https://centreslapointe.com/site/trois-rivieres/?utm_source=GMB_Listing&utm_medium=organic&utm_campaign=GMB,Results,"оғҲ761 Bd Thibeau, Trois-RiviГЁres, QC G8T 7A4, Canada",QC G8T 7A4,Canada,оӮ°+1 514-527-6468
https://www.411sante.com/hygieniste-dentaire/mauricie/trois-rivieres-2/soins-dentaire-trois-rivieres.htm,Results,"оғҲ835 Bd des RГ©collets, Trois-RiviГЁres, QC G8Z 3W6, Canada",QC G8Z 3W6,Canada,оӮ°+1 819-996-8383
https://www.centredentairemauricie.com/,Results,"оғҲ9422 Chem. Sainte-Marguerite, Trois-RiviГЁres, QC G9B 6K2, Canada",QC G9B 6K2,Canada,оӮ°+1 819-377-2086
http://www.drguybrule.com/,Results,"оғҲ436 Bd Thibeau, Trois-RiviГЁres, QC G8T 6Z1, Canada",QC G8T 6Z1,Canada,оӮ°+1 819-373-3661
https://cliniquedentairemauricie.com/,Results,"оғҲ695 Bd Thibeau, Trois-RiviГЁres, QC G8T 7A2, Canada",QC G8T 7A2,Canada,оӮ°+1 819-372-3368
http://centredentairetroisrivieres.com/,Results,"оғҲ5495 Boulevard Jean-XXIII, Trois-RiviГЁres, Quebec G8Z 4A8, Canada",Quebec G8Z 4A8,Canada,оӮ°+1 819-379-2091
http://centredentairegenestgelinas.com/,Results,"оғҲ5775 Boulevard Jean-XXIII #100, Trois-RiviГЁres, Quebec G8Z 4J2, Canada",Quebec G8Z 4J2,Canada,оӮ°+1 819-691-1343
https://www.411sante.com/dentiste/mauricie/trois-rivieres-4/soins-dentaires-trois-rivieres.htm,Results,"оғҲ1340 Rue Notre Dame E, Trois-RiviГЁres, QC G8T 4J3, Canada",QC G8T 4J3,Canada,оӮ°+1 819-378-4597
http://www.cliniquedentairetroisrivieres.com/,Results,"оғҲ313 Rue Barkoff, Trois-RiviГЁres, QC G8T 2A5, Canada",QC G8T 2A5,Canada,оӮ°+1 819-693-3388
https://www.cegeptr.qc.ca/population/clinique-hygiene-dentaire/,Results,"оғҲ3500 Rue de Courval, Trois-RiviГЁres, QC G8Z 3S7 Rue de Courval, Trois-RiviГЁres, QC G8Z 3S7, Canada",QC G8Z 3S7,Canada,оӮ°+1 819-378-9839
http://www.cliniquedusourire.info/,Results,"оғҲ1380 Rue Gilles Lupien, Trois-RiviГЁres, QC G8Y 7J4, Canada",QC G8Y 7J4,Canada,оӮ°+1 819-375-7555
https://www.centredentairelindaleclair.ca/,Results,"оғҲ3075 CГҙte Richelieu, Trois-RiviГЁres, QC G8Y 6L9, Canada",QC G8Y 6L9,Canada,оӮ°+1 819-376-4955
https://www.centredentairelemelin.com/,Results,"оғҲ765 Bd Thibeau, Trois-RiviГЁres, QC G8T 7A4, Canada",QC G8T 7A4,Canada,оӮ°+1 819-374-6636
https://www.cliniquedentaireasselin.com/,Results,"оғҲ3196 Bd Saint-Jean, Trois-RiviГЁres, QC G9B 2M1, Canada",QC G9B 2M1,Canada,оӮ°+1 819-379-7901
http://www.vraisourire.com/,Results,"оғҲ2 Rue Fusey, Trois-RiviГЁres, QC G8T 2T3, Canada",QC G8T 2T3,Canada,оӮ°+1 819-375-5550
http://www.medifusion.ca/fr/centre-dentaire-isabelle-veilleux,Results,"оғҲ7110 Rue Marion, Trois-RiviГЁres, QC G9A 0A7, Canada",QC G9A 0A7,Canada,оӮ°+1 819-373-4545
http://www.endomauricie.com/,Results,"оғҲ7110, rue Marion 101-A, 7110 Rue Marion #102, Trois-RiviГЁres, QC G9A 0A7, Canada",QC G9A 0A7,Canada,оӮ°+1 819-489-0587
https://www.411sante.com/hygieniste-dentaire/mauricie/trois-rivieres-3/soins-dentaire-trois-rivieres.htm,Results,"оғҲ1060 Rue St FranГ§ois Xavier #125, Trois-RiviГЁres, QC G9A 1R8, Canada",QC G9A 1R8,Canada,оӮ°+1 819-979-2697
https://drmelaniecampese.com/,Results,"оғҲ55 Rue des Forges, Trois-RiviГЁres, QC G9A 6A7, Canada",QC G9A 6A7,Canada,оӮ°+1 819-841-0147
http://www.maxillomauricie.com/,Results,"оғҲ6065 Rue Corbeil, Trois-RiviГЁres, QC G8Z 4S6, Canada",QC G8Z 4S6,Canada,оӮ°+1 819-378-4353
https://www.cliniquedentaireasselin.com/notre-equipe,Results,"оғҲ3196 Bd Saint-Jean, Trois-RiviГЁres, QC G9B 2M1, Canada",QC G9B 2M1,Canada,оӮ°+1 819-379-7901
http://cedam.ca/,Results,"оғҲ5495 Boulevard Jean-XXIII Bur 200, Trois-RiviГЁres, QC G8Z 4A8, Canada",QC G8Z 4A8,Canada,оӮ°+1 819-375-6258
https://bukoreso.com/succursale/trois-rivieres/,Results,"оғҲ2 Rue Fusey, Trois-RiviГЁres, QC G8T 2T1, Canada",QC G8T 2T1,Canada,оӮ°+1 819-375-5550
http://www.denturologistedugre.ca/,Results,"оғҲ3625 Rue Papineau, Trois-RiviГЁres, QC G8Y 1N6, Canada",QC G8Y 1N6,Canada,оӮ°+1 819-375-7958
https://mondentistetr.com/dre-ren%C3%A9e-auclair,Results,"оғҲ3910 Bd des Forges, Trois-RiviГЁres, QC G8Y 1V7, Canada",QC G8Y 1V7,Canada,оӮ°+1 819-373-8636
https://www.mondenturomauricie.com/,Results,"оғҲ3050 Bd Saint-Jean, Trois-RiviГЁres, QC G9B 2M9, Canada",QC G9B 2M9,Canada,оӮ°+1 819-378-5154
http://www.orthodontiequebec.com/gagnon,Results,"оғҲ5535 Bd des Forges, Trois-RiviГЁres, QC G8Y 5L5, Canada",QC G8Y 5L5,Canada,оӮ°+1 819-379-8337
http://www.orthomauricie.com/,Results,"оғҲ925 Rue Laviolette bureau 202, Trois-RiviГЁres, Quebec G9A 1V9, Canada",Quebec G9A 1V9,Canada,оӮ°+1 819-379-6626
http://www.lecentredentaire3r.com/,Results,"оғҲ4550 Av. Arsenault, BГ©cancour, QC G9H 1V8, Canada",QC G9H 1V8,Canada,оӮ°+1 819-233-2222
https://www.anugo.ca/fr/entreprise/255897-guylaine-ricard-denturologiste-denturologistes-trois-rivieres.html,Results,"оғҲ190 Rue Rochefort, Trois-RiviГЁres, QC G8T 7J5, Canada",QC G8T 7J5,Canada,оӮ°+1 819-693-9206
http://www.dentisteslarochelachance.com/,Results,"оғҲ5605 Boulevard Jean-XXIII, Trois-RiviГЁres, Quebec G8Z 4A8, Canada",Quebec G8Z 4A8,Canada,оӮ°+1 819-371-2221
http://cliniquedenturologiemarcducharme.ca/,Results,"оғҲ6560 Rue Amyot, Trois-RiviГЁres, QC G9B 1X7, Canada",QC G9B 1X7,Canada,оӮ°+1 819-370-1218
http://denturheault.com/,Results,"оғҲ3075 CГҙte Richelieu #200, Trois-RiviГЁres, Quebec G8Z 4C5, Canada",Quebec G8Z 4C5,Canada,оӮ°+1 819-373-1214
https://cliniquedesgrandesrivieres.com/,Results,"оғҲ197 7e Avenue, Dolbeau-Mistassini, QC G8L 2S5, Canada",QC G8L 2S5,Canada,оӮ°+1 418-276-5551
https://www.drmasse.com/site/accueil?utm_source=G&utm_medium=LPM&utm_campaign=DentalCorp,Results,"оғҲ2780 Bd Masson Ste 200, QuГ©bec, QC G1P 1J6, Canada",QC G1P 1J6,Canada,оӮ°+1 581-702-4539
http://cliniquedentairelaperriere.ca/,Results,"оғҲ303 Pierre-Bertrand Blvd, QuГ©bec City, Quebec G1M 3L7, Canada",Quebec G1M 3L7,Canada,оӮ°+1 418-681-8141
https://www.carrefourdentairetroisrivieres.com/site/accueil?utm_source=G&utm_medium=LPM&utm_campaign=DentalCorp,Results,"оғҲ700 Bd Thibeau Local 240, Trois-RiviГЁres, QC G8T 7A1, Canada",QC G8T 7A1,Canada,оӮ°+1 819-372-1118
